Req. Status,Fusion,PO. No,PR. Line No,Department,PR No,PR Date,Item Code,Item Name,UOM,Qty,Delivery Date,Buyer,Description,PR Year,PR Month,PR Day
APPROVED,,,2.0,not available,7274.0,2024-01-30,1001-00048-0000,LEVOFLOXACIN HEMIHYDRATE,KGs,1000.0,2024-04-15,Mumtaz,,2024.0,1.0,30.0
APPROVED,,,1.0,not available,7072.0,2024-02-01,6153-00020-0000,CANVAS SHOES GENTS,PRS,90.0,2024-09-01,Abuzar Hasani,Required shoes for the period Jan-Jun 2024,2024.0,2.0,1.0
APPROVED,,,11.0,Utilities,7084.0,2024-03-01,6254-00065-0000,DIESEL,LTR,5000.0,2024-05-01,Atif Salam,For Standby Generators,2024.0,3.0,1.0
APPROVED,,,1.0,Utilities,7084.0,2024-03-01,6254-00065-0000,DIESEL,LTR,20000.0,2024-05-01,Atif Salam,For Standby Generators,2024.0,3.0,1.0
APPROVED,,,10.0,not available,7272.0,2024-01-30,6303-00074-0000,RIBBON PRINTER MODEL: ERC-09 BRAND: EPSON,NOS,10.0,2024-06-02,Atif Salam,TONER FOR I.T INVENTORY,2024.0,1.0,30.0
APPROVED,,,1.0,not available,7272.0,2024-01-30,6303-00025-0000,TONER HP LASERJET PRO 402 M402DN (26A),NOS,30.0,2024-02-02,Atif Salam,TONER FOR I.T INVENTORY,2024.0,1.0,30.0
APPROVED,,,1.0,not available,7127.0,2024-11-01,1110-00003-1001,MOULDED CLEAR GLASS VIAL 300ml - Common Material,NOS,15000.0,2024-10-04,Mumtaz,,2024.0,11.0,1.0
APPROVED,,,3.0,not available,7248.0,2024-01-26,3006-00051-0000,CALIBRATION CHARGES,JOB,2.0,2024-06-02,Atif Salam,"Calibration of BP Apparatus, Oxygen Cylinder Pressure gauge and flow meter",2024.0,1.0,26.0
APPROVED,,,3.0,Engineering (Common),7309.0,2024-02-02,3005-00008-0000,LABOUR CHARGES,JOB,1.0,2024-06-02,Atif Salam,REQUIRED FOR BOILER,2024.0,2.0,2.0
APPROVED,,,1.0,Engineering (Common),7226.0,2024-01-24,3005-00008-0000,LABOUR CHARGES,JOB,1.0,2024-01-29,Atif Salam,REQUIRED FOR CIVIL WORK LAYING DIESEL PIPE LINE,2024.0,1.0,24.0
APPROVED,,,1.0,Engineering (Common),7237.0,2024-01-25,3005-00010-0000,LABOUR CHARGES WITH MATERIAL,JOB,1.0,2024-01-30,Atif Salam,REQUIRED FOR REPLACEMENT GYPSUM FALSE CEILING WHOLE AREA DUE TO SEEPAGE EFFECTED CEMENT REPAIR WORK IN TABLET STAGING TO PYODINE MFG AREA,2024.0,1.0,25.0
APPROVED,,,3.0,Engineering (Common),7124.0,2024-11-01,3005-00010-0000,LABOUR CHARGES WITH MATERIAL,JOB,1.0,2024-01-16,Atif Salam,REQUIRED FOR INSTALLATION OF POWER PANELS AT PLOT 59-PANEL ROOM NAL PROJECT,2024.0,11.0,1.0
APPROVED,,,2.0,Engineering (Common),7216.0,2024-01-24,3005-00013-0000,TRANSPORTATION CHARGES,JOB,1.0,2024-01-31,Mumtaz,REQUIRED FOR WATSON MARLOW PUMP OF BG400 COATER,2024.0,1.0,24.0
APPROVED,,,1.0,Quality Control (Common),7270.0,2024-01-30,3005-00014-0000,FREIGHT CHARGES,JOB,1.0,2024-02-23,Mumtaz,For Standardization and Routine Testing,2024.0,1.0,30.0
APPROVED,,,2.0,Engineering (Common),7273.0,2024-01-30,3005-00014-0000,FREIGHT CHARGES,JOB,1.0,2024-06-02,Mumtaz,URGENTLY REQUIRED REPLACEMENT OF PART AT CMP MACHINE. PACKAGING DEPARTMENT,2024.0,1.0,30.0
APPROVED,,,3.0,Quality Control (Common),7205.0,2024-01-23,6406-00039-0000,USP REFERENCE STANDARD KETOROLAC RELATED COMPOUND A,NOS,1.0,2024-02-23,Mumtaz,USP Reference Standard,2024.0,1.0,23.0
APPROVED,,,1.0,Warehouse,7079.0,2024-03-01,3005-00004-0000,INSTALLATION CHARGES - MECHANICAL JOBS,JOB,1.0,,Atif Salam,Creating new Buffer Area in finished goods offsite warehouse,2024.0,3.0,1.0
APPROVED,,,7.0,not available,7072.0,2024-02-01,6153-00026-0000,SHOES FOR DRIVER,PRS,11.0,2024-09-01,Abuzar Hasani,Required shoes for the period Jan-Jun 2024,2024.0,2.0,1.0
APPROVED,,,6.0,Engineering (Common),7160.0,2024-01-16,3005-00027-0000,LABOUR CHARGES ( HVAC ),SFT,300.0,2024-01-23,Atif Salam,REQUIRED FOR DUCTING WORKS IN PACKAGING HALL.,2024.0,1.0,16.0
APPROVED,,,5.0,Quality Control (Common),7205.0,2024-01-23,6406-00070-0000,USP REFERENCE STANDARD CLARITHROMYCIN IDENTITY,NOS,1.0,2024-02-23,Mumtaz,USP Reference Standard,2024.0,1.0,23.0
APPROVED,,,7.0,Quality Control (Common),7207.0,2024-01-23,6406-00098-0000,"USP REFERENCE STANDARD TRAMADOL RELATED COMPOUND A, CATALOG NO. 1672610",NOS,1.0,2024-02-23,Mumtaz,USP Reference Standard (Controlled STD),2024.0,1.0,23.0
APPROVED,,,1.0,not available,7275.0,2024-01-30,3006-00070-0000,WASTE WATER TESTING,JOB,9.0,2024-07-02,Atif Salam,Environmental Monitoring of 09 sampling Points to for COD & BOD limits Investigation,2024.0,1.0,30.0
APPROVED,,,2.0,Engineering (Common),7235.0,2024-01-25,5109-00023-0000,"WINDING WIRE (COPPER) SIZE NO. 21, MAKE: GHAZI",KGs,5.0,2024-01-02,Abuzar Hasani,REQUIRED FOR CHILLER PUMP MOTOR. PLOT-58,2024.0,1.0,25.0
APPROVED,,,4.0,Engineering (Common),7235.0,2024-01-25,5122-00513-0000,"VARNISH, 2.6 LITER, GHAZI",PKS,2.0,2024-01-02,Abuzar Hasani,REQUIRED FOR CHILLER PUMP MOTOR. PLOT-58,2024.0,1.0,25.0
APPROVED,,,1.0,not available,7246.0,2024-01-26,5101-00088-0000,EMERGENCY LIGHT INDUSTRIAL DUAL HEAD LED VERSION,NOS,30.0,2024-06-02,Atif Salam,Industrial Emergency Lights & Safety Shoes,2024.0,1.0,26.0
APPROVED,,,7.0,Engineering (Common),7235.0,2024-01-25,5112-00020-0000,"HEAT PROOF SLEEVE, SIZE NO. 03, MAKE: GHAZI",NOS,50.0,2024-01-02,Abuzar Hasani,REQUIRED FOR CHILLER PUMP MOTOR. PLOT-58,2024.0,1.0,25.0
APPROVED,,,1.0,Engineering (Common),7172.0,2024-01-17,5122-00600-0000,LED DRIVER 220VAC 18-25W,NOS,24.0,2024-01-24,Atif Salam,"REQUIRED REPLACEMENT/SPARE PART FOR LED LIGHTS INSTALLED AT UTILITY BUILDING/HEAD OFFICE,  QC/QA OFFICES",2024.0,1.0,17.0
APPROVED,,,1.0,Engineering (Common),7134.0,2024-12-01,5122-00528-0000,ELECTROMAGNETIC BOLT LOCK 12 VDC STAINLESS STEEL FINISH,NOS,3.0,2024-01-19,Atif Salam,REQUIRED REPLACEMENT OF PART AT FFSA & GFSA PASS BOX,2024.0,12.0,1.0
APPROVED,,,1.0,"Health, Safety And Environment (Common)",7185.0,2024-01-18,5232-00111-0000,VALVE OF DCP TYPE FIRE EXTINGUISHER,NOS,2.0,2024-01-31,Atif Salam,Service maintenance & refilling of fire extinguisher,2024.0,1.0,18.0
APPROVED,,,1.0,Quality Control (Common),7205.0,2024-01-23,6406-00238-0000,USP REFERENCE STANDARD TACROLIMUS CATALOG NO.1642802,NOS,1.0,2024-02-23,Mumtaz,USP Reference Standard,2024.0,1.0,23.0
APPROVED,,,1.0,Sterile (Common),7224.0,2024-01-24,5405-00199-0000,PIPE FLEXIBLE FOR VACUUM CLEANER,RFT,1.0,2024-01-31,Abuzar Hasani,vaccuum cleaner pipe required for ampoule washing machine,2024.0,1.0,24.0
APPROVED,,,1.0,Quality Control (Common),7184.0,2024-01-18,6407-00033-0000,PEEK NUT MALE,NOS,25.0,2024-01-31,Rashid Ayub,PEEK NUT MALE,2024.0,1.0,18.0
APPROVED,,,1.0,Engineering (Common),7151.0,2024-01-15,5122-01051-0000,SELECTOR MOTOR SWITCH ON / OFF,NOS,6.0,2024-01-22,Atif Salam,"REQUIRED REPLACEMENT/SPARE PART FOR ACL FILLING MACHINE, BQS I & II MACHINES. PACKAGING AND STERILE PRODUCTION",2024.0,1.0,15.0
APPROVED,,,3.0,Quality Control (Common),7307.0,2024-02-02,6406-00303-0000,EP REFERENCE STANDARD PARACETAMOL IMPURITY J CRS EUROPEAN PHARMACOPIA ORDER CODE # Y0001945,NOS,1.0,2024-02-29,Rashid Ayub,EP Reference standards,2024.0,2.0,2.0
APPROVED,,,4.0,Engineering (Common),7230.0,2024-01-24,5122-01288-0000,PROGRAMMABLE CONTROLLER MODEL: FX1N-24MT BRAND: MITSUBISHI,NOS,1.0,2024-01-31,Atif Salam,REQUIRED REPLACEMENT OF PART AT GEL FILLING MACHINE & AMPOULE BLISTER MACHINE,2024.0,1.0,24.0
APPROVED,,,2.0,not available,7079.0,2024-03-01,3005-00043-0000,INSTALLATION CHARGES - MECHANICAL JOBS,RFT,1.0,,Atif Salam,Creating new Buffer Area in finished goods offsite warehouse,2024.0,3.0,1.0
APPROVED,,,4.0,not available,7131.0,2024-12-01,6406-00344-0000,USP REFERENCE STANDARD SEVOFLURANE RELATED COMPOUND C CATALOG NO: 1612594,NOS,1.0,2024-01-31,Mumtaz,"USP Reference Standards required for the testing of Sevofluran, Isoflurane and Desflurane",2024.0,12.0,1.0
APPROVED,,,3.0,Engineering (Common),7235.0,2024-01-25,5109-00032-0000,"WINDING WIRE (COPPER) SIZE: NO. 21.5 , MAKE: GHAZI",KGs,5.0,2024-01-02,Abuzar Hasani,REQUIRED FOR CHILLER PUMP MOTOR. PLOT-58,2024.0,1.0,25.0
APPROVED,,,8.0,International Business - Head Office,7081.0,2024-03-01,6451-00683-0000,BLOCK PAD WITH 500 SLIPS - EPRAZOLE / ACLENE / ARNIL - EXPORT,NOS,4000.0,2024-10-01,Atif Salam,PM,2024.0,3.0,1.0
APPROVED,,,1.0,Mechanical,7306.0,2024-02-02,5412-00041-0000,"STAR COUPLING SIZE: OUTER DIA: 65mm, HUB DIA: 38mm THICKNESS: 13mm, 8 LINKS PLASTIC MOULDED",NOS,2.0,,Abuzar Hasani,REQUIRED FOR H.D 80 CARTONING MACHINE,2024.0,2.0,2.0
APPROVED,,,3.0,Engineering (Common),7230.0,2024-01-24,5122-01513-0000,EXPANSION MODULE MODEL: EM 222 CN DC 222-1BF22-0XA8 BRAND: SIEMENS,NOS,1.0,2024-01-31,Atif Salam,REQUIRED REPLACEMENT OF PART AT GEL FILLING MACHINE & AMPOULE BLISTER MACHINE,2024.0,1.0,24.0
APPROVED,,,2.0,Utilities,7309.0,2024-02-02,5122-01518-0000,"SOLENOID VALVE INLET SIZE: 1/4"", OUTLET SIZE"" 1/4"", THICKNESS"" 40mm (FOR DIESEL)",NOS,1.0,2024-06-02,Atif Salam,REQUIRED FOR BOILER,2024.0,2.0,2.0
APPROVED,,,1.0,not available,7274.0,2024-01-30,1001-00015-0000,CIPROFLOXACIN HCL,KGs,1000.0,2024-04-15,Mumtaz,,2024.0,1.0,30.0
APPROVED,,,2.0,not available,7310.0,2024-02-02,1003-00021-0000,CELLULOSE MICROCRYSTALLINE AVICEL PH102,KGs,500.0,2024-02-28,Mumtaz,,2024.0,2.0,2.0
APPROVED,,,1.0,Engineering (Common),7235.0,2024-01-25,5109-00001-0000,"WINDING WIRE (COPPER) SIZE NO. 20, MAKE: GHAZI",KGs,5.0,2024-01-02,Abuzar Hasani,REQUIRED FOR CHILLER PUMP MOTOR. PLOT-58,2024.0,1.0,25.0
APPROVED,,,11.0,not available,7148.0,2024-01-15,5105-00008-0000,CIRCUIT BREAKER 6 AMP SINGLE PHASE,NOS,7.0,2024-01-15,Abuzar Hasani,,2024.0,1.0,15.0
APPROVED,,,6.0,not available,7072.0,2024-02-01,6153-00020-0000,CANVAS SHOES GENTS,PRS,30.0,2024-09-01,Abuzar Hasani,Required shoes for the period Jan-Jun 2024,2024.0,2.0,1.0
APPROVED,,,9.0,not available,7272.0,2024-01-30,6303-00066-0000,IMAGING DRUM HP 19A LASERJET,NOS,5.0,2024-06-02,Atif Salam,TONER FOR I.T INVENTORY,2024.0,1.0,30.0
APPROVED,,,5.0,not available,7272.0,2024-01-30,6303-00071-0000,TONER HP LASERJET PRO MFP M130FW (17A),NOS,12.0,2024-06-02,Atif Salam,TONER FOR I.T INVENTORY,2024.0,1.0,30.0
APPROVED,,,1.0,Quality Control (Common),7150.0,2024-01-15,6402-00051-0000,FLUID THIOGLYCOLATE MEDIUM,GMS,2000.0,2024-01-22,Rashid Ayub,For Micro Testing Purpose,2024.0,1.0,15.0
APPROVED,,,1.0,not available,7287.0,2024-01-31,1106-00007-1001,FLIP OFF SEAL RED 32mm - Common Material,NOS,100000.0,2024-05-03,Rashid Ayub,,2024.0,1.0,31.0
APPROVED,,,1.0,not available,7253.0,2024-01-29,3005-00009-0000,SERVICES CHARGES,JOB,1.0,2024-05-02,Abuzar Hasani,REPAIRING OF CANTEEN LED,2024.0,1.0,29.0
APPROVED,,,1.0,Engineering (Common),7239.0,2024-01-25,3005-00010-0000,LABOUR CHARGES WITH MATERIAL,JOB,1.0,2024-01-30,Atif Salam,REQUIRED FOR CORDON OFF AREA UNDER REPAIR AND MAINTENANCE WORK PYODINE MFG,2024.0,1.0,25.0
APPROVED,,,1.0,Engineering (Common),7244.0,2024-01-25,3005-00010-0000,LABOUR CHARGES WITH MATERIAL,JOB,1.0,2024-01-31,Atif Salam,REQUIRED CIVIL WORK FOR SHADE ON ROOF NAL PROJECT PLOT-58,2024.0,1.0,25.0
APPROVED,,,2.0,not available,7124.0,2024-11-01,3005-00010-0000,LABOUR CHARGES WITH MATERIAL,JOB,1.0,2024-01-16,Atif Salam,REQUIRED FOR INSTALLATION OF POWER PANELS AT PLOT 59-PANEL ROOM NAL PROJECT,2024.0,11.0,1.0
APPROVED,,,4.0,Quality Control (Common),7205.0,2024-01-23,6406-00042-0000,USP REFERENCE STANDARD KETOROLAC RELATED COMPOUND D,NOS,1.0,2024-02-23,Mumtaz,USP Reference Standard,2024.0,1.0,23.0
APPROVED,,,5.0,Engineering (Common),7161.0,2024-01-16,3005-00027-0000,LABOUR CHARGES ( HVAC ),SFT,250.0,2024-01-23,Atif Salam,REQUIRED FOR DUCTING WORKS IN GRANULATION AREA.,2024.0,1.0,16.0
APPROVED,,,6.0,Quality Control (Common),7207.0,2024-01-23,6406-00097-0000,"USP REFERENCE STANDARD TRAMADOL HYDROCHLORIDE, CATALOG NO. 1672600",NOS,1.0,2024-02-23,Mumtaz,USP Reference Standard (Controlled STD),2024.0,1.0,23.0
APPROVED,,,5.0,not available,7121.0,2024-11-01,6256-00021-0000,"CARTRIDGE FILTER HYDROPHILIC 0.22 MICRON CAT NO. 5102507H1 BRAND: SARTORIUS, GERMANY",NOS,10.0,2024-01-13,Atif Salam,filters required for primary filtration of products,2024.0,11.0,1.0
APPROVED,,,3.0,"Health, Safety And Environment (Common)",7185.0,2024-01-18,7001-00108-0000,PIPE FOR FIRE EXTINGUISHER,NOS,4.0,2024-01-31,Atif Salam,Service maintenance & refilling of fire extinguisher,2024.0,1.0,18.0
APPROVED,,,3.0,Logistics,7174.0,2024-01-17,3008-00005-0000,RENTAL REEFER CONTAINER 40 FEET,NOS,3.0,2024-02-28,Atif Salam,Requisition for rent refer container for 6 months.,2024.0,1.0,17.0
APPROVED,,,3.0,Engineering (Common),7161.0,2024-01-16,5304-00179-0000,"INSULATION THERMOPORE 1"" THICK",SFT,250.0,2024-01-23,Atif Salam,REQUIRED FOR DUCTING WORKS IN GRANULATION AREA.,2024.0,1.0,16.0
APPROVED,,,1.0,Engineering (Common),7137.0,2024-12-01,5115-00042-0000,SMOKE SENSOR OPTICAL ADVANCED ADDRESSABLE IVORY WITH BASE MODEL: HM-PSE-S2 BRAND: MORLEY BY HONEYWELL,NOS,18.0,2024-01-19,Atif Salam,REQUIRED REPLACEMENT OF FAULTY PARTS AT PLO-59 FIRE ALARM SYSTEM,2024.0,12.0,1.0
APPROVED,,,2.0,"Health, Safety And Environment (Common)",7185.0,2024-01-18,5213-00039-0000,PRESSURE GAUGE FOR FIRE EXTINGUISHER,NOS,2.0,2024-01-31,Atif Salam,Service maintenance & refilling of fire extinguisher,2024.0,1.0,18.0
APPROVED,,,4.0,Engineering (Common),7161.0,2024-01-16,5234-00768-0000,FLEXIBLE CONNECTION,NOS,1.0,2024-01-23,Atif Salam,REQUIRED FOR DUCTING WORKS IN GRANULATION AREA.,2024.0,1.0,16.0
APPROVED,,,1.0,Mechanical,7308.0,2024-02-02,5224-00088-0000,SHEET MASONITE FIBRE THREAD THICKNESS: 9mm,KGs,1.0,,Abuzar Hasani,REQUIRED FOR AUTO LABELLER PYODINE,2024.0,2.0,2.0
APPROVED,,,1.0,Engineering (Common),7269.0,2024-01-30,5212-00098-0000,CYLINDER PNEUMATIC MODEL: ODNC-32-100 PPVA,NOS,1.0,2024-06-02,Atif Salam,REQUIRED FOR AUTO PACKER OF PYODINE FILLING MACHINE. PACKAGING DEPARTMENT,2024.0,1.0,30.0
APPROVED,,,1.0,Mechanical,7304.0,2024-02-02,5219-00016-0000,PIPE PNEUMATIC HEAT PROOF SIZE: 8mm x 5.5mm,RFT,200.0,,Abuzar Hasani,REQUIRED FOR AMPOULE WASHING MACHINE GROUND FLOOR STERILE AREA,2024.0,2.0,2.0
APPROVED,,,1.0,Packaging (Common),7236.0,2024-01-25,6254-00261-0000,INK CARTRIDGE HSAJET BLACK No. K4011Si - FOR NON-POROUS SUBSTRATE,NOS,10.0,2024-01-31,Atif Salam,for printers,2024.0,1.0,25.0
APPROVED,,,2.0,Engineering (Common),7137.0,2024-12-01,5122-00901-0000,ADRESSABLE MANUAL CALL POINT GLASS ELEMENT INCLUDED WITH SR1T BACK BOX MODEL: MI-MCP-GLASS,NOS,12.0,2024-01-19,Atif Salam,REQUIRED REPLACEMENT OF FAULTY PARTS AT PLO-59 FIRE ALARM SYSTEM,2024.0,12.0,1.0
APPROVED,,,1.0,Quality Control (Common),7109.0,2024-10-01,6406-00258-0000,"SECONDARY REFERENCE STANDARD MEDROXY PROGESTERONE ACETATE ,CATALOG NO. PHR1589 BRAND: SIGMA ALDRICH",NOS,2.0,2024-01-31,Rashid Ayub,SECONDARY REFERENCE STANDARD MEDROXY PROGESTERONE ACETATE,2024.0,10.0,1.0
APPROVED,,,8.0,not available,7072.0,2024-02-01,6153-00051-0000,SHOES FOR CANTEEN WAITERS,PRS,16.0,2024-09-01,Abuzar Hasani,Required shoes for the period Jan-Jun 2024,2024.0,2.0,1.0
APPROVED,,,1.0,not available,7131.0,2024-12-01,6406-00342-0000,USP REFERENCE STANDARD SEVOFLURANE CATALOG NO: 1612540,NOS,2.0,2024-01-31,Mumtaz,"USP Reference Standards required for the testing of Sevofluran, Isoflurane and Desflurane",2024.0,12.0,1.0
APPROVED,,,5.0,not available,7131.0,2024-12-01,6406-00346-0000,USP REFERENCE STANDARD ISOFLURANE CATALOG NO: 1349003,NOS,2.0,2024-01-31,Mumtaz,"USP Reference Standards required for the testing of Sevofluran, Isoflurane and Desflurane",2024.0,12.0,1.0
APPROVED,,,1.0,Sterile (Common),7254.0,2024-01-29,6256-00061-0000,REPLACEMENT MEMBRANES (3) AND KCL FILL SOLUTION PART NO: 522 019B,NOS,1.0,2024-01-02,Atif Salam,Membrane required for dissolved oxygen meter,2024.0,1.0,29.0
APPROVED,,,7.0,International Business - Head Office,7081.0,2024-03-01,6451-00684-0000,SLIP CONTAINER - ARNIL / EPRAZOLE - EXPORT,NOS,700.0,2024-10-01,Atif Salam,PM,2024.0,3.0,1.0
APPROVED,,,5.0,International Business - Head Office,7081.0,2024-03-01,6451-00686-0000,BALL PEN METAL - ARNIL GEL / LEVOCIT - EXPORT,NOS,5000.0,2024-10-01,Atif Salam,PM,2024.0,3.0,1.0
APPROVED,,,1.0,Quality Control (Common),7299.0,2024-01-02,6402-00143-0000,POTASSIUM PERIODATE,GMS,100.0,2024-02-29,Rashid Ayub,Potassium periodate,2024.0,1.0,2.0
APPROVED,,,1.0,Engineering (Common),7231.0,2024-01-24,5122-01512-0000,CHART RECORDER PEN MODEL: DR 4300,NOS,2.0,2024-01-31,Atif Salam,REQUIRED REPLACEMENT OF PART AT CHART RECORDER PELLET MANUFACTURING AREA,2024.0,1.0,24.0
APPROVED,,,1.0,International Business - Head Office,7095.0,2024-05-01,6452-00592-0000,"POSTER ARNIL SIZE: 17"" x 24"" COLOR PRINTING, EXPORT GROUP 11 - POSTER ARNIL/EXPORT/SRI",NOS,500.0,2024-01-15,Rashid Ayub,Promotion Material,2024.0,5.0,1.0
APPROVED,,,3.0,not available,7274.0,2024-01-30,1001-00093-0000,KETOROLAC TROMETHAMINE,KGs,3.0,2024-04-25,Mumtaz,,2024.0,1.0,30.0
APPROVED,,,4.0,not available,7204.0,2024-01-23,1003-00130-0000,STARCH MAIZE,KGs,500.0,2024-03-20,Rashid Ayub,,2024.0,1.0,23.0
APPROVED,,,4.0,not available,7272.0,2024-01-30,6303-00014-0000,TONER FOR HP LASERJET 1536 PRINTER (78A),NOS,12.0,2024-06-02,Atif Salam,TONER FOR I.T INVENTORY,2024.0,1.0,30.0
APPROVED,,,1.0,Quality Control (Common),7221.0,2024-01-24,6401-00012-0000,HYDROCHLORIC ACID,LTR,10.0,2024-07-02,Rashid Ayub,Liquid chemicals for QC Lab,2024.0,1.0,24.0
APPROVED,,,5.0,Quality Control (Common),7221.0,2024-01-24,6401-00017-0000,PERCHLORIC ACID 70%,LTR,1.0,2024-07-02,Rashid Ayub,Liquid chemicals for QC Lab,2024.0,1.0,24.0
APPROVED,,,8.0,not available,7138.0,2024-12-01,1306-00001-1001,SPRAY PUMP - Common Material,NOS,100000.0,2024-01-04,Mumtaz,,2024.0,12.0,1.0
APPROVED,,,3.0,not available,7289.0,2024-01-31,1308-00281-1002,CARTON XIFAXA 550mg TABLETS C/P - (ND) - Local Pack C/P,NOS,25000.0,2024-02-20,Rashid Ayub,,2024.0,1.0,31.0
APPROVED,,,2.0,not available,7248.0,2024-01-26,3006-00051-0000,CALIBRATION CHARGES,JOB,1.0,2024-06-02,Atif Salam,"Calibration of BP Apparatus, Oxygen Cylinder Pressure gauge and flow meter",2024.0,1.0,26.0
APPROVED,,,1.0,Engineering (Common),7240.0,2024-01-25,3005-00010-0000,LABOUR CHARGES WITH MATERIAL,JOB,1.0,2024-01-30,Atif Salam,REQUIRED FOR REPAIR AND MAINTENANCE CIVIL WORK IN PYODINE MFG AREA,2024.0,1.0,25.0
APPROVED,,,3.0,not available,7227.0,2024-01-24,3005-00010-0000,LABOUR CHARGES WITH MATERIAL,JOB,4.0,2024-01-29,Atif Salam,REQUIRED FOR TILT AND DISBALANCE S.S DOORS OF CEPH AREA PLOT-59,2024.0,1.0,24.0
APPROVED,,,2.0,not available,7246.0,2024-01-26,6153-00024-0000,SAFETY SHOES,PRS,64.0,2024-06-02,Atif Salam,Industrial Emergency Lights & Safety Shoes,2024.0,1.0,26.0
APPROVED,,,4.0,not available,7203.0,2024-01-23,1105-00037-1002,ALUMINIUM TUBE PYODINE GEL 20gm C/P - (ND) - Local Pack C/P,NOS,100000.0,2024-03-15,Rashid Ayub,,2024.0,1.0,23.0
APPROVED,,,1.0,Quality Control (Common),7307.0,2024-02-02,6406-00109-0000,EP REFERENCE STANDARDS DICLOFENAC SYSTEM SUITABILITY ORDER CODE# Y0001635,NOS,2.0,2024-02-29,Rashid Ayub,EP Reference standards,2024.0,2.0,2.0
APPROVED,,,2.0,Quality Control (Common),7129.0,2024-11-01,6405-00062-0000,PYCNOMETER 25ML,NOS,2.0,2024-01-31,Rashid Ayub,FLASK KJELDAHL FK 500/3L and PYCNOMETER 25ML,2024.0,11.0,1.0
APPROVED,,,3.0,Quality Control (Common),7207.0,2024-01-23,6406-00171-0000,USP REFERENCE STANDARD FENTANYL CITRATE CATALOG NO. 1270005,NOS,1.0,2024-02-23,Mumtaz,USP Reference Standard (Controlled STD),2024.0,1.0,23.0
APPROVED,,,1.0,Logistics,7174.0,2024-01-17,3008-00005-0000,RENTAL REEFER CONTAINER 40 FEET,NOS,6.0,2024-02-28,Atif Salam,Requisition for rent refer container for 6 months.,2024.0,1.0,17.0
APPROVED,,,1.0,Engineering (Common),7251.0,2024-01-29,5232-00105-0000,"VALVE FOOT BRASS SIZE: 3""",NOS,2.0,,Abuzar Hasani,REQUIRED FOOT VALVE REPLACEMENT OF STORAGE TANK FOR NAL PROJECT,2024.0,1.0,29.0
APPROVED,,,3.0,Engineering (Common),7160.0,2024-01-16,5304-00179-0000,"INSULATION THERMOPORE 1"" THICK",SFT,300.0,2024-01-23,Atif Salam,REQUIRED FOR DUCTING WORKS IN PACKAGING HALL.,2024.0,1.0,16.0
APPROVED,,,1.0,Engineering (Common),7117.0,2024-11-01,5232-00114-0000,"VALVE HAND CONTROL 5/2 WAY 1/4"" MODEL: TSV8652-02M MAKE: SHAKO - TAIWAN",NOS,1.0,,Atif Salam,REQUIRED FOR GRALL MIXER,2024.0,11.0,1.0
APPROVED,,,1.0,Sterile (Common),7214.0,2024-01-24,6402-00126-0000,COLD FILTERABLE TSB,GMS,3000.0,2024-01-31,Rashid Ayub,TSB cold filterable required for Cephalosporin and FFSA media fill,2024.0,1.0,24.0
APPROVED,,,2.0,Warehouse,7155.0,2024-01-15,6254-00307-0000,"CABLE TIE (Nylon) Size 10""",NOS,2500.0,2024-01-22,Abuzar Hasani,For maintain inventory,2024.0,1.0,15.0
APPROVED,,,9.0,not available,7131.0,2024-12-01,6406-00345-0000,USP REFERENCE STANDARD SODIUM FLUORIDE CATALOG NO: 1614002,NOS,1.0,2024-01-31,Mumtaz,"USP Reference Standards required for the testing of Sevofluran, Isoflurane and Desflurane",2024.0,12.0,1.0
APPROVED,,,1.0,Engineering (Common),7232.0,2024-01-24,5122-01459-0000,"SOLENOID VALVES 2/2 WAY MODEL: SPU220A-06, 24VDC BRAND - SHAKO",NOS,5.0,2024-01-31,Atif Salam,REQUIRED REPLACEMENT OF PART AT FFSA WASHING MACHINE. STERILE PRODUCTION,2024.0,1.0,24.0
APPROVED,,,11.0,International Business - Head Office,7081.0,2024-03-01,6451-00680-0000,BALL PEN METAL - RYXONCEF / INCETEX - YEMEN,NOS,1000.0,2024-10-01,Atif Salam,PM,2024.0,3.0,1.0
APPROVED,,,4.0,International Business - Head Office,7081.0,2024-03-01,6451-00687-0000,TISSUE BOX - CLOVIREX / LEVOCIT - EXPORT,NOS,2000.0,2024-10-01,Atif Salam,PM,2024.0,3.0,1.0
APPROVED,,,1.0,not available,7125.0,2024-11-01,1001-00061-0000,MINOXIDIL,KGs,50.0,2024-11-03,Mumtaz,,2024.0,11.0,1.0
APPROVED,,,6.0,not available,7192.0,2024-01-19,1001-00030-0000,EFLORINITHINE HCL,KGs,15.0,2024-03-19,Mumtaz,,2024.0,1.0,19.0
APPROVED,,,10.0,not available,7148.0,2024-01-15,5105-00006-0000,CHOCK ELECTRONIC TUBE LIGHT 2 X TL-5 28 WATTS 220-240,NOS,10.0,2024-01-15,Abuzar Hasani,,2024.0,1.0,15.0
APPROVED,,,9.0,not available,7148.0,2024-01-15,5108-00004-0000,CABLE WIRE 7/29,MTR,100.0,2024-01-15,Abuzar Hasani,,2024.0,1.0,15.0
APPROVED,,,24.0,not available,7148.0,2024-01-15,5114-00006-0000,"RELAY INDUSTRIAL POWER 8 PIN FLAT, 24 VDC, MODEL 55,33",NOS,3.0,2024-01-15,Abuzar Hasani,,2024.0,1.0,15.0
APPROVED,,,8.0,not available,7148.0,2024-01-15,5122-00043-0000,BED SWITCH,NOS,8.0,2024-01-15,Abuzar Hasani,,2024.0,1.0,15.0
APPROVED,,,15.0,not available,7148.0,2024-01-15,5214-00005-0000,LOCK PAD 25MM,NOS,12.0,2024-01-15,Abuzar Hasani,,2024.0,1.0,15.0
APPROVED,,,13.0,not available,7148.0,2024-01-15,5212-00001-0000,"ELBOW METAL BODY PNEUMATIC SIZE: 10MM X 1/4""",NOS,5.0,2024-01-15,Abuzar Hasani,,2024.0,1.0,15.0
APPROVED,,,14.0,not available,7148.0,2024-01-15,5212-00005-0000,"ELBOW METAL BODY PNEUMATIC SIZE: 6MM X 1/8""",NOS,10.0,2024-01-15,Abuzar Hasani,,2024.0,1.0,15.0
APPROVED,,,7.0,not available,7148.0,2024-01-15,5222-00022-0000,BALL BEARING 6205 ZZ MAKE: NTN,NOS,8.0,2024-01-15,Abuzar Hasani,,2024.0,1.0,15.0
APPROVED,,,29.0,not available,7148.0,2024-01-15,5230-00007-0000,"TRAP STEAM T.L.V., Y TYPE, THREAD 1''",NOS,1.0,2024-01-15,Abuzar Hasani,,2024.0,1.0,15.0
APPROVED,,,31.0,not available,7148.0,2024-01-15,5407-00011-0000,VALVE SOCKET SIZE: 1'' CPVC,NOS,4.0,2024-01-15,Abuzar Hasani,,2024.0,1.0,15.0
APPROVED,,,1.0,Engineering (Common),7206.0,2024-01-23,5405-00071-0000,"PIPE PVC REINFORCED STEEL WIRE SIZE: 1-1/2""",RFT,60.0,2024-01-30,Abuzar Hasani,REQUIRED FOR TEMPORARY ARRANGEMENTS FOR R.O WATER TRANSFER FROM CEPH TO MAIN WATER TREATMENT PLANT,2024.0,1.0,23.0
APPROVED,,,1.0,Engineering (Common),7193.0,2024-01-19,6254-00025-0000,GAS ARGON CYLINDER FOR WELDING,NOS,1.0,2024-01-23,Atif Salam,REQUIRED FOR WORKSHOP,2024.0,1.0,19.0
APPROVED,,,2.0,Quality Control (Common),7150.0,2024-01-15,6402-00049-0000,TRYPTIC SOYA AGAR,GMS,4000.0,2024-01-22,Rashid Ayub,For Micro Testing Purpose,2024.0,1.0,15.0
APPROVED,,,3.0,not available,7311.0,2024-02-02,1307-00045-1002,STICKER PYODINE SOLUTION 450ml - Local Pack C/P,NOS,100000.0,2024-02-28,Rashid Ayub,,2024.0,2.0,2.0
APPROVED,,,1.0,Engineering (Common),7136.0,2024-12-01,3005-00008-0000,LABOUR CHARGES,JOB,1.0,2024-01-19,Atif Salam,REQUIRED SHIFTING / DISMANTLING OF POWER PANELS AT PLOT-59 PANEL ROOM. NAL PROJECT,2024.0,12.0,1.0
APPROVED,,,7.0,Quality Control (Common),7221.0,2024-01-24,6401-00037-0000,TRIETHYL AMINE,ml,1000.0,2024-07-02,Rashid Ayub,Liquid chemicals for QC Lab,2024.0,1.0,24.0
APPROVED,,,1.0,not available,7245.0,2024-01-25,6254-00205-0000,HOT RIBBON FOIL FC3 SIZE: 27MM X 165M,NOS,500.0,2024-07-02,Atif Salam,for pyodine annd syrup line labeller,2024.0,1.0,25.0
APPROVED,,,1.0,Quality Control (Common),7207.0,2024-01-23,6406-00116-0000,"USP REFERENCE STANDARD MIDAZOLAM CIV, CATALOG NO. 1443599",NOS,1.0,2024-02-23,Mumtaz,USP Reference Standard (Controlled STD),2024.0,1.0,23.0
APPROVED,,,7.0,Engineering (Common),7161.0,2024-01-16,3005-00034-0000,LABOUR CHARGES ( HVAC ),JOB,1.0,2024-01-23,Atif Salam,REQUIRED FOR DUCTING WORKS IN GRANULATION AREA.,2024.0,1.0,16.0
APPROVED,,,23.0,not available,7148.0,2024-01-15,5212-00144-0000,"REGULATOR PNEUMATIC PUSH PULL FLOW SIZE: 6MM X 1/8""",NOS,2.0,2024-01-15,Abuzar Hasani,,2024.0,1.0,15.0
APPROVED,,,1.0,Engineering (Common),7297.0,2024-01-02,5122-01112-0000,"HMI MODEL: 6AV6 643-0CD01-1AX1, MP277 10"" BRAND: SIEMENS",NOS,1.0,2024-08-02,Atif Salam,URGENTLY REQUIRED REPLACEMENT OF PART AT HD-80 MACHINE. PACKAGING DEPARTMENT,2024.0,1.0,2.0
APPROVED,,,2.0,Quality Control (Common),7307.0,2024-02-02,6406-00302-0000,EP REFERENCE STANDARD PARACETAMOL IMPURITY K CRS EUROPEAN PHARMACOPIA ORDER CODE # Y0001955,NOS,1.0,2024-02-29,Rashid Ayub,EP Reference standards,2024.0,2.0,2.0
APPROVED,,,5.0,not available,7289.0,2024-01-31,1311-00070-1001,MASTER CARTON 39 - (ND) - Common Material,NOS,3000.0,2024-02-25,Rashid Ayub,,2024.0,1.0,31.0
APPROVED,,,3.0,not available,7131.0,2024-12-01,6406-00343-0000,USP REFERENCE STANDARD SEVOFLURANE RELATED COMPOUND B CATALOG NO: 1612572,NOS,1.0,2024-01-31,Mumtaz,"USP Reference Standards required for the testing of Sevofluran, Isoflurane and Desflurane",2024.0,12.0,1.0
APPROVED,,,6.0,not available,7131.0,2024-12-01,6406-00347-0000,USP REFERENCE STANDARD ISOFLURANE RELATED COMPOUND A CATALOG NO: 1349014,NOS,1.0,2024-01-31,Mumtaz,"USP Reference Standards required for the testing of Sevofluran, Isoflurane and Desflurane",2024.0,12.0,1.0
APPROVED,,,10.0,Engineering (Common),7235.0,2024-01-25,5109-00033-0000,WINDING PAPER (NOMEX) SIZE NO. 10,KGs,2.0,2024-01-02,Abuzar Hasani,REQUIRED FOR CHILLER PUMP MOTOR. PLOT-58,2024.0,1.0,25.0
